org_url;url_visited;name;address;email;phone;VAT;description;activities;boolDrone;eCommerce;socialMedia;region;jobs;inCountry;isCompany;isSelected;action;created
https://www.topoprogram.com;https://www.topoprogram.com;Topoprogram & Service s.a.s.;Via delle Ville   5 - 89013 – Gioia Tauro;info@topoprogram.it;096651089, 04011994, 096651345, 01293700801;01293700801;Dagli specialisti in Catasto e Topografia tutte le soluzioni software per la tua attività di topografo;filming/imaging, consultancy;True;True;https://www.facebook.com/topoprogram, https://twitter.com/@pinomangione, https://www.instagram.com/topoprogram, https://www.youtube.com/user/topoprogram, https://www.linkedin.com/in/pino-mangione-25840a4b, http://www.youtube.com/user/topoprogram, http://twitter.com/#!/@pinomangione, https://www.facebook.com/#!/topoprogram, http://it.linkedin.com/pub/pino-mangione/4b/40a/258;Vibo Valentia;True;True;True;1;text extracted and checked and selected;2000-06-02
https://www.geoskylab.com;https://www.geoskylab.com;Piloti APR | Geoskylab | Lombardia;Via Albert Einstein   5 24044 Dalmine;info@geoskylab.com;04007790167;04007790167;​richiedi informazionichi siamogeoskylab è stata la prima azienda autorizzata dall'autorità aeronautica enac come organizzazione di consulenza e d'addestramento piloti droni;consultancy;True;False;https://www.instagram.com/geoskylab, https://www.facebook.com/geoskylab;Bergamo;False;True;True;1;text extracted and checked and selected;2013-12-16
http://comune.vimodrone.milano.it/hh/index.php;http://comune.vimodrone.milano.it/hh/index.php;Comune di Vimodrone;. 25077 266 / 249 / 206 il Martedì e il Giovedì . . . Segui il feed | tutti i contenuti Comune di Vimodrone, . + 39 02 250771 Fax + 39 02 2500316 PEC del Comune Posta, Via Cesare Battisti   56 20055 Vimodrone;comune.vimodrone@pec.regi;08112021, 02042021, 3902250771, 03022022, 04022022, 03112020, 06102021, +3902250771, 31012022, 00858950967, 07430220157, 03012022, 07042021, +39022500316, 09022022, 041418;00858950967, 39022500316, 07430220157;Il Sito Istituzionale del Comune di Vimodrone (MI). Le informazioni del Comune con Albo Pretorio, Amministrazione Trasparente e i Servizi e-Gov.;training, filming/imaging;True;False;https://www.youtube.com/user/comunevimodrone, https://twitter.com/ComuneVimodrone, https://www.facebook.com/comunevimodrone;Brescia, Rieti, Milano;True;True;True;1;text extracted and checked and selected;0
https://uav.ap74.it;https://uav.ap74.it;CORSI DRONE VERONA BRESCIA MANTOVA VENEZIA CREMONA ENAC | CORSO PILOTI APR | LOMBARDIA EMILIA VENETO TRENTINO;: 00 Ispirati da Eccellenza ed Innovazione Offriamo una larga gamma di corsi drone di Alto, : 00 Ispirati da Eccellenza ed Innovazione Offriamo una larga gamma di corsi di Alto, : 00 Giugno 17th   2020 | Leggi di più 0 DJI Matrice;;+390455117752, 0455117752, +393276272957;;Ispirati da Eccellenza ed Innovazione   Offriamo una larga gamma di corsi drone di Alto Livello e Formazione Specifica per Piloti di APR  Operazioni su commissione con APR  Consulenza e Manualistiche Enac per APR  Vendita di APR;sales, training, consultancy;True;False;https://www.youtube.com/channel/UC2ksGL4D8EX--aLrOAUmgbw, https://www.facebook.com/ap74uav;Cuneo, Campobasso;False;True;True;1;text extracted and checked and selected;2020-01-10
https://www.jpdroni.it;https://www.jpdroni.it;JP Droni srl - Genova, servizi aerei con droni;Via Jacopo Ruffini 9 / 1A 16128 - Genova, Via Jacopo Ruffini 9 / 1A 16128- Genova;info@jpdroni.it;02407120993;;In JP Droni siamo specializzati in riprese aeree, ispezioni tecniche di edifici e impianti, servizi per l'agricoltura 4.0...;filming/imaging;True;True;https://www.instagram.com/jpdronisrl, https://www.youtube.com/channel/UCwnCXOAK7eZvu88_DcppECQ, http://www.linkedin.com/company/jpdroni, http://www.instagram.com/jpdronisrl, https://www.facebook.com/JPDroni, http://linkedin.com/in/francesco-sperandio-8b20a5162, http://linkedin.com/in/paolo-scuteri-536aa1a3, http://linkedin.com/in/jacopo-callà-245727141, http://linkedin.com/in/laura-mazzier-5a243a184, http://linkedin.com/in/pietro-cartasegna-1ab14a180, http://linkedin.com/in/filippo-materazzi-753a02109, http://linkedin.com/in/letizia-carenini-3b94221a5, http://linkedin.com/in/federico-falbo-95741a1a5;Genova;True;True;True;1;text extracted and checked and selected;2016-05-10
http://www.dronescaligera.it;http://www.dronescaligera.it;SERVIZI – Drone Scaligera;: Matteo Lanza Scaligera Drone Solutions di Lanza Matteo   via Pietro Mascagni   7 – Bovolone, . Scaligera Drone Solutions di Lanza Matteo   via Pietro Mascagni   7 – Bovolone;info@dronescaligera.it;3485510873, 04495160238;04495160238;[…];distributing, inspection;True;True;https://www.linkedin.com/in/matteo-lanza-154aa2165, https://twitter.com/ScaligeraDrone, https://www.instagram.com/scaligera_drone_solutions, https://www.facebook.com/ScaligeraDrone;Verona;False;True;True;1;text extracted and checked and selected;2017-07-04
http://www.hobbyqueenitalia.com;http://www.hobbyqueenitalia.com;hobbyqueenitalia | Hobbyqueenitalia.com;: 4 © hobbyqueenitalia P . IVA 05630190659 Di Michele Ciancio Roccapiemonte, : 3 © hobbyqueenitalia P . IVA 05630190659 Di Michele Ciancio Roccapiemonte, : 9 © hobbyqueenitalia P . IVA 05630190659 Di Michele Ciancio Roccapiemonte;;3932178338, 05630190659;05630190659;le batterie demon occl rappresentano il nostro orgoglio frutto di anni di ricerca e passione;training;True;True;https://www.facebook.com/sacha.cecconi, http://www.facebook.com/pages/HobbyQueenItalia/188206834561874;Salerno;False;True;True;1;text extracted and checked and selected;2011-09-06
https://www.droinwork.it;https://www.droinwork.it;Droinwork | Drone Aerial Sevices;Vocabolo Bodoglie snc 06059 Todi ( PG ) - Italy, . Orvietana Ovest 12 06059 Todi ( PG ) - Italy, Circonvallazione Orvietana Ovest 12 06059 Todi;info@droinwork.it, droinwk@pec-legal.it, p.dodaj@droinwork.al, emergenza@italdron.com;+390759370825, +355682072681, 03477980548, 3477980548, +393779828761, 3000000, 3062003, 0759370825;03477980548, IT03477980548;DROINWORK è una società leader nei servizi di lavoro aereo con l’uso di DRONI. Tra le prime aziende autorizzate in Italia da ENAC, ci avvaliamo dei migliori professionisti specializzati nei vari ambiti operativi dove svolgiamo la nostra attività professionale.  Forniamo la perfetta combinazione di competenze e conoscenze in diversi settori e puntiamo da sempre al massimo valore dei nostri servizi. Oltre fornire ai nostri clienti risultati certi e a proporre soluzioni adeguate per ogni nuova sfida che affrontiamo, poniamo grande attenzione alla sicurezza delle operazioni e garantiamo la massima professionalità in ogni fase del lavoro.;training, filming/imaging, inspection;True;True;https://twitter.com/DroinWork, https://www.facebook.com/ServiziDroni;Arezzo;True;True;True;1;text extracted and checked and selected;2012-11-03
https://www.distek.it;https://www.distek.it;Distek - Strumentazioni e servizi per aziende leader di mercato;Via Generale Orsini   42 – 80132 Napoli ( NA )   Italia, Via Fedro   7 – 80122 Napoli ( NA )   Italia;info@distek.it, renato@distek.it, marco@distek.it, dario@distek.it, vincenzo.vosa@distek.it, roberta.palmisano@distek.it, roberta@distek.it, marco.giorgi@distek.it, amministrazione@distek.it, maintenance@distek.it, distek@pec.it;05058341214, +393357611904, +390810112166, +39335450212, +3908119360024, +393483827387, +393483837815, +393381904621, +39081661003;05058341214;Soluzioni all'avanguardia per la tua attività. Strumentazioni delle più importanti marche ed un team di professioni altamente specializzato.;maintaining;True;True;;Napoli;False;True;True;1;text extracted and checked and selected;2000-06-28
https://www.dronihub.com;https://www.dronihub.com;DroniHub specialisti del mondo dei droni a Napoli – DroniHub Napoli;00 Aggiungi al carrello Insta360 ONE X2 – Garanzia Ufficiale Italia;info@dronihub.com;01954160501, +393925486471;01954160501;Vendita al dettagli di tutto l'universo Dji come droni, accessori, stabilizzatori ed action cam. Corso pilota droni Enac. Negozio su Napoli.;sales, training, components;True;True;https://www.facebook.com/dronihubmedia;;False;True;True;1;text extracted and checked and selected;2017-06-06
http://www.geoapp.it;http://www.geoapp.it;Geoapp – Power Up Safety;Via F . Veracini 30 / G - 50144 Firenze ( Italy;info@geoapp.it, info@pec.geoa;06563960480, +390553985470;06563960480;natural hazards services for the risk management of rock falls, landslides, sinkholes and land subsidence affecting inhabitated areas;filming/imaging, inspection;True;True;;Firenze;False;True;True;1;text extracted and checked and selected;2010-11-17
https://www.ftoremotefly.com;https://www.ftoremotefly.com;FTOremotefly;Viale dell’industria 19 - 35129 Padova Campo volo : C / O “Ali Venete” - Via Ca’Onorai 50 - 35013 Cittadella, Via Sorio 89 - 35141 Padova Sede operativa : C / O Paradigma - Viale;info@ftoremotefly.com, g.candiani@ftoremotefly.com, v.rocco@ftoremotefly.com, f.sanguin@ftoremotefly.com, s.brugnaro@ftoremotefly.com, r.noventa@ftoremotefly.com, e.signor@ftoremotefly.com, m.dedomeneghi@ftoremotefly.com;+393926358810;;Società che si occupa di servizi con i droni. Agenzia riconosciuta da ENAC   per corsi ed esami Open A2. Si occupa di produzioni multimediali, foto e   video a 360°, fotogrammetria, rilievi termici, laser scanner, agricoltura   di precisione e ispezione infrastrutture.;manufacturing, training, filming/imaging, inspection;True;True;https://www.facebook.com/ftoremoteflydroni, https://www.instagram.com/fto_remotefly;Padova;True;True;True;1;text extracted and checked and selected;2014-04-09
https://www.universodroni.it;https://www.universodroni.it;Universo Droni;;info@universodroni.it;+393933845273, 02576460204, +393478102312, 02451800201;02576460204, 02451800201;Quiz drone eserciziario con domande e risposte;;True;True;;Mantova;False;True;True;1;text extracted and checked and selected;2017-09-07
https://alto-drones.com/it;https://alto-drones.com/it/;Home;Via Pillhof 43A 39057 Frangarto / Appiano Alto Adige | Italia;info@alto-drones.com;02842740215, +3904711551234;02842740215;la nostra missioneservizio con uav certificatioffriamo servizi in camp dei rilievi e spezioni techniche, opperando in alto adige, italia, austria, germania, svizzera e danimarca;inspection;True;True;https://www.facebook.com/altodrones;Bolzano-Bozen;False;True;True;1;text extracted and checked and selected;2018-04-19
https://www.integraerospace.it;https://www.integraerospace.it;IAS | Integrated Aerospace Systems;. it Integrated Aerospace Systems srl - via Friuli   70 00041 Cecchina di Albano Laziale | P . IVA e C . F . 11469611005 Uff . Registro delle imprese di Roma, Via Friuli   n . 70 00041- Cecchina di Albano Laziale ( Roma;info@integraerospace.it, integratedaerospacesystemssrl@lamiapec.it;+393398974893, +390695550791, +393466680166, 0693496375, +390693496375, +393333807473, +393483660392, +39069341686, 069341686;11469611005;ias | integrated aerospace systems;;True;True;https://www.facebook.com/IntegratedAerospaceSystems, https://www.linkedin.com/company/integrated-aerospace-systems-afm;Roma;False;True;True;1;text extracted and checked and selected;2011-06-28
https://www.ugcs.com/resellers;https://www.ugcs.com/resellers;UgCS;Via Petrarca 42   Cambi Bisenzio 50013 ( Firenze ) Italy Siralab Robotics srl www . siralab . com Via Narni 211   05100 Terni;;325538, 012267, 04101000, 0620021, 350000, 3286415;;com inc;filming/imaging, inspection;True;True;https://www.linkedin.com/company/sph-engineering, https://twitter.com/SPHEngineering, https://www.youtube.com/user/ugcstv, https://www.instagram.com/ugcsdrones, https://www.facebook.com/SPHEngineering;Firenze;False;True;True;1;text extracted and checked and selected;1999-11-06
https://d-flight.jtdrone.com;https://d-flight.jtdrone.com;D-Flight JT DRONE;. Via Monte Misone 85 Riva del Garda;info@jtdrone.com, amministrazione@pec.jtdr;02413910221, +390464557776;02413910221;Dispositivo brevettato per il controllo nello spazio aereo di un velivolo a pilotaggio remoto. La JT DRONE presenta la soluzione brevettata nel 2016.;;True;True;https://www.facebook.com/JTDRONESRL, https://www.instagram.com/jtdrone;Verona;False;True;True;1;text extracted and checked and selected;2015-11-03
https://www.dronelab.it;https://www.dronelab.it;DroneLab Aviation - Make Your Sky;"  solo adesso comprendo a fondo il loro sacrificio . \ Nel 2008 da Piacenza""";info@dronelab.it;+393896149466;;multi purpose aerial platformscopri skyqubel'aziendal’aziendadronelab è un’azienda italiana di successo nella progettazione e commercializzazione di sistemi aeromobili a pilotaggio remoto (droni) per applicazioni industriali, sar (search and rescue), sorveglianza aerea, aerofotogrammetria, videoispezioni, aerotermografia, agricoltura di precisione, delivery drones, wave & air analysis e piattaforme aeree per cinematografia;filming/imaging;True;True;;Piacenza;False;True;True;1;text extracted and checked and selected;2013-12-02
https://www.dronext.eu;https://www.dronext.eu;Patentino drone A1 A2 A3 | Dronext SRL | Italia;. 000 manuali A1-A3   A2   ZONE ROSSE ENAC - EASA e TARIFFARIO DEL DRONISTA venduti in Italia, . DRONEXT SRL dal 2017 l ' azienda leader in Italia;info@dronext.eu, dronext@legalmail.it;01815090335, 01022022, 3283666209;01815090335;Dronext.eu: domande e risposte per PATENTINO DRONE A1/A2/A3 ENAC EASA - Manuali obbligatori drone, registrazione D-FLIGHT, zone rosse, tariffario e assicurazione drone;sales;True;True;https://www.instagram.com/dronext.eu, https://twitter.com/dronext_eu, https://www.facebook.com/dronext.eu, http://vimeo.com/dronexteu;;False;True;True;1;text extracted and checked and selected;2022-02-21
https://www.geodatalab.it;https://www.geodatalab.it;GeoDataLab | Sistemi Informativi Territoriali e Sviluppo Software;Via Tiburtina   912 – 00156 Roma Via Saracena   15B – 89135 Reggio Calabria Via di Corticella   315 – 40128 Bologna, Via Tiburtina   912 – 00156 Roma Via Saracena   15B – 89135 Reggio Calabria Via di Corticella   315 – 40129 Bologna, Via Saracena   15B - 89135 Reggio Calabria | P . IVA : 02893570800 Numero Rea;management@geodatalab.it, geodatalab@legalmail.it;02893570800, +390686299586;02893570800;"GeoDataLab è una start-up innovativa che si fonda su quindici anni di esperienza nel campo dei sistemi informativi territoriali, del telerilevamento satellitare e del management aziendale.     Rivoluziona il tuo Business     Pensando \GIS\""      Rivoluziona il tuo Business     Pensando \""GIS\""        PENSARE GIS   Scopri cosa significa""";design;True;True;https://twitter.com/GeoDataLab_Srls, https://www.youtube.com/channel/UCByScy0AB5f6eZRu4z1ZhBg, https://it.linkedin.com/company/geodatalab-srls;Roma, Vibo Valentia;True;True;True;1;text extracted and checked and selected;2015-05-29
http://www.dronefly.it;http://www.dronefly.it;DRONEFLY | AERIAL DRONE SERVICE | DRONE RENTAL | AERIAL STOCK FOOTAGE;Via Della Cecchignoletta 14 - 00143 Roma - Italy FERRARA - Via Delle Acacie 7 - 44123 Ferrara - Italy;info@dronefly.it;01913810386, +393392007865;01913810386;DRONEFLY  |  AERIAL DRONE SERVICE  |  DRONE RENTAL | AERIAL STOCK FOOTAGE;;True;False;https://www.youtube.com/channel/UCk5c2fK2oLvcz_4yMoFjOhQ, https://www.facebook.com/riccardo.filippini.568;Ferrara;False;True;True;1;text extracted and checked and selected;2011-07-29
https://www.drone-zone.it;https://www.drone-zone.it;DRONE ZONE - Soluzioni APR per te: Servizi, Formazione e Consulenza;Via Interporto Centro Ingrosso 114   Pasiano di Pordenone Pordenone;info@drone-zone.it;01779320934, +3904341697154;01779320934;Drone zone risponde a tutte le esigenze degli Operatori SAPR. Dalla scelta del Drone alla specializzazione professionale nel Settore;training, consultancy;True;True;https://it-it.facebook.com/Drone.Zone.it, https://www.instagram.com/dronezone_srl, https://www.youtube.com/channel/UCUQjn4KirK8jKcZcT14AzOA;Pordenone;False;True;True;1;text extracted and checked and selected;2014-04-06
https://www.rov-subacquei.it;https://www.rov-subacquei.it;Rov Subacquei – Droni Subacquei – Exploring new worlds;Via Di Porto   18A – 50018 – Scandicci ( FI ) info @ eurosportos . it Tel : + 39 055 720 750 Distributore esclusivo per l ' Italia, Via Di Porto   18A - 50018 - Scandicci;info@rov-subacquei.it, info@eurosportos.it;04654450487, +39055720750;04654450487, 39055720750;gladius mini è la seconda generazione di droni subacquei chasing-innovation, che riunisce una gamma completa di evoluzione tecnologica, oltre a una profonda comprensione della stabilizzazione della fotografia subacquea e dell’ispezione subacquea;filming/imaging;True;True;https://www.facebook.com/rovsub, https://www.youtube.com/channel/UCyYM52flX4XR2IUKlqM7D4Q, https://www.instagram.com/rov_italia;Firenze;False;True;True;1;text extracted and checked and selected;2018-02-27
http://www.asterx.it;http://www.asterx.it;Video col drone Riprese aeree Piemonte - Italia;Via San Bernolfo 73   12084 Mondovi;info@asterx.it;3085510042, 03085510042, 01731996090;IT03085510042, 03085510042;Riprese aree e video col drone in Piemonte e tutta Italia. Noleggio droni, piloti abilitati ENAC. Video drone Cuneo - Termografie;renting, filming/imaging;True;True;http://www.facebook.com/asterxict;Cuneo;False;True;True;1;text extracted and checked and selected;2006-01-30
https://hdaerial.com;https://hdaerial.com;Aerial Cinematography Company;. Purge 5 “The Forever Purge” We Can Be Heroes   Robert Rodriguez Atlas Shrugged Crossing the Rio,   and can accommodate many size payloads . Gyron FS 35mm Near the Amalfi Coast   Italy;;5129300008, 8047098000, 8008977637;;We are a professional aerial cinematography company specializing in drone productions and manned helicopter cinematography.;filming/imaging, components, inspection;True;True;;Livorno, Salerno;False;True;True;1;text extracted and checked and selected;2005-04-14
https://www.dronearezzo.com;https://www.dronearezzo.com;Drone Arezzo - Aerial Cinematography | Servizio riprese con Droni pro.;Via Fratelli Lumiere   19 52100 Arezzo ( AR ) Italy;dronearezzo@gmail.com;393388794998, 390575, 02256240512, 380744, 3388794998;02256240512;Drone Arezzo è un team specializzato in riprese video aeree con droni professionali di ultima generazione. Operiamo in tutta Italia e all'estro.;filming/imaging;True;True;https://www.instagram.com/drone_arezzo_italy, https://www.facebook.com/videodronearezzo;Arezzo;True;True;True;1;text extracted and checked and selected;2014-06-07
https://www.stefanotrojani.com/pilota-drone-certificato-enac;https://stefanotrojani.com/pilota-drone-certificato-enac/;Pilota drone certificato enac - Stefano Trojani;. Pagine – Gennaio 2018 Fotografo nella mostra Street Photography Firenze,   e video in slow motion 1080p a 120 fps Fonte, . Foto a 360 gradi El Tatio Lago;contatto@stefanotrojani.com;06858140483;06858140483;Pilota Droni Certificato ENAC con base a Firenze per riprese e foto aeree. Guarda i possibili utilizzi commericiali delle riprese fatte col drone.;filming/imaging;True;True;https://www.facebook.com/strojani, https://twitter.com/tjstewie, https://vimeo.com/356657262, https://www.linkedin.com/in/strojani, https://vimeo.com/331244194, https://instagram.com/strojani, https://vimeo.com/stefanotrojani, https://www.youtube.com/channel/UCoy62UP5d5qeGm2MTF0vlQQ, https://twitter.com/TJstewie;Firenze, Treviso, Cosenza;True;True;True;1;text extracted and checked and selected;2010-11-10
http://www.extinsrl.it;http://www.extinsrl.it;Pipeline inspection, Welding inspection, NACE inspection South Italy, UAV inspection Italy - EXTIN SRL;Via Lamastella   468 74020 Leporano ( TA )   Italy, Via Endertà   12 74012 Crispiano ( TA )   Italy, Via Lamastella   268 - 74020 Leporano;info@extinsrl.it;02917350734, +390999422489, +393463310646;02917350734;EX.T.IN. SRL performs the surveillance of your suppliers on your behalf by offering worldwide inspection and expediting services. Pipeline inspection, Welding inspection, NACE coating inspection South Italy, NACE inspector South Italy, UAV inspection Italy;inspection;True;True;https://www.youtube.com/channel/UCQq0t42dYl11bFWV7HVR3ow, https://www.linkedin.com/company/ex.t.in.-srl, https://it.linkedin.com/company/ex.t.in.-srl;Taranto;True;True;True;1;text extracted and checked and selected;2012-12-14
http://dronotica.weebly.com;http://dronotica.weebly.com;Dronotica Italia - Aerial Film Technology;Via Capo di Lago snc 03030 - Villa S . Lucia ( FR ) Richiedi Info e Preventivi Name * Primo Ultimo;dronotica@gmail.com;02428980607;02428980607;Società specializzata nella Vendita e Assitenza di DRONI, riprese e montaggio per Enti, società private e privati.;sales, filming/imaging;True;True;http://vimeo.com/user23771042, http://vimeo.com/85474565, https://vimeo.com/158825095, https://vimeo.com/user23771042/videos, https://vimeo.com/129587239, http://vimeo.com/101172906, https://vimeo.com/139749453, https://vimeo.com/user23771042, http://www.youtube.com/rmestaff;Frosinone;False;True;True;1;text extracted and checked and selected;2006-03-29
https://icarodroni.it;https://icarodroni.it;Riprese e Foto Aree con Droni a Pescara in Abruzzo di IcaroDroni;Via Aventino 10 66023 Francavilla al Mare;;3278199405, 085814137;IT02481460695;Società esperta nella tecnologia dei Droni con Video e Immagini Aree sul territorio nazionale con sede a Pescara;filming/imaging;True;False;https://www.facebook.com/icarodroni, https://www.youtube.com/channel/UC56QLW9vCUyFrK8TUEecA9A;Chieti;False;True;True;1;text extracted and checked and selected;2014-04-16
https://www.dronerp.com;https://www.dronerp.com;DronERP : the managing software for your drone business;Via G . Carducci 3   24020 Ranica ( BG ) - Italia;info@dronextreme.eu;+39035362040, +393314760950;;DronERP is a software to easily plan and organize drones company resources. A stand alone software to manage Uav sevice and classic business administration;;True;True;https://www.youtube.com/channel/UC9mrNBc6xSa0nt22_2AKLCA, https://www.linkedin.com/company/dev-software, https://www.facebook.com/devsoftwaresrl;Bergamo;False;True;True;1;text extracted and checked and selected;2019-12-13
https://www.centroformazionevolo.it;https://www.centroformazionevolo.it;Home - Perugia Corso Droni | Centro Formazione Volo Umbria;Via Aldo Palazzeschi   28 06073 Corciano Perugia ( PG ) – Italy, Via Aldo Palazzeschi   28 06073 Corciano Perugia – Italy;info@centroformazionevolo.it;01815730542, +390755159361;01815730542;Il Centro di Formazione Volo è un centro di addestramento autorizzato ENAC.Fornisce corsi ed attestati per piloti di aereomobili e di APR droni;training;True;False;https://www.instagram.com/centroformazionevolo, https://www.youtube.com/channel/UCnKS5-wOUSJj2yzPypp-moA, https://www.facebook.com/centroformazionevolo, https://www.facebook.com/Aeroporto-Eleuteri-Castiglione-del-lago-893587677351792;Arezzo;True;True;True;1;text extracted and checked and selected;2019-05-22
https://airservicecenter.it/it;https://airservicecenter.it/it;Scuola per Elicotteristi Pavia Milano Piacenza - Air Service Center - Servizio Trasporto Materiali e Persone con Elicotteri;;;+393356233327, 3356358570, +390385272117, 01261630188, 3356358848, 3356735346;01261630188;Air Service Center è una scuola di volo per elicotteristi sita in Lombardia, Italia - con istruttori specializzati di elevata esperienza.;training, manufacturing, maintaining, filming/imaging;True;False;https://www.instagram.com/air_service_center, https://www.facebook.com/Air-Service-Center-S%C3%BCdtirol-Alto-Adige-500452206796480;Pisa;False;True;True;1;text extracted and checked and selected;2015-02-24
https://www.aerovision.it;https://www.aerovision.it;Aerovision | Scuola Piloti Droni - Centro Addestramento ENAC | Roma;Via Francesco Morandini   30 Roma 00142   Italia Tel . 06 1211 27000 Lazio – Istituto Tecnico Salvo D’Acquisto Piazza Santa Croce   2 Castel Giuliano   RM 00062   Italy, Via IV Novembre 9 / 11 Ariccia ( Roma ) 00072   Italia Tel . 06 9320433 / 06 9323597 Lazio – IIS De Pinedo Colonna Via Francesco Morandini   30 Roma, Via del Casale di S . Pio V   44 Roma   Italia 00165 Lazio – Castelli Romani Via IV Novembre 9 / 11 Ariccia ( Roma ) 00072   Italia, Via Pitagora n . 4 Palmi   RC 89015 Tel . 096646887 Sicilia – associazione centro studi Agorà Via A . Diaz 43 / D​ Palermo, Via Nizza 32 Martano   LE 73025   Italia Tel . 3275977299 Calabria – Aviosuperficie Sibari Fly Località Contrada, Via Vincenzo Lamaro   25 Roma   RM 00173   Italia Tel . 06 768893 Puglia – SalentoDroni Via Nizza 32 Martano, Contrada Pantano Rotondo SP169 Cassano allo Ionio   CS 87011   Italia Calabria – Palmi, Via A . Diaz 43 / D​ Palermo   PA 90100   Italia, Via Duccio di Buoninsegna   55 – 00142 Roma, Via Duccio Di Buoninsegna   55 00142 Roma, Viale dei Campioni   8 00144 Roma;info@aerovision.it, giovanni.formosa@aerovision.it, loredana.scaffa@aerovision.it;+39065190363, 06768893, 06121127000, 069987464, 3069323597, 3275977299, +393485163194, 096646887, 065190363;12698221004;Corsi per Pilota UAS,Open Category e Specific, autorizzato ENAC. Corsi specializzati. Riprese aeree, montaggio video e servizi per le aziende;training, filming/imaging;True;True;https://www.facebook.com/aerovisionitalia, https://www.instagram.com/aerovision_flying_cameras, https://vimeo.com/aerovisionitalia, https://www.youtube.com/channel/UCw7puQ_kKMrLAl3x1UxQhIg, https://www.linkedin.com/company/aerovision-it;Pavia, Roma, Vibo Valentia, Lecce, Cosenza, Palermo;False;True;True;1;text extracted and checked and selected;2013-06-03
