org_url;url_visited;name;address;email;phone;VAT;description;activities;boolDrone;eCommerce;socialMedia;region;jobs;inCountry;isCompany;isSelected;action;created
https://www.alpharobotix.com/?lang=en;https://www.alpharobotix.com/?lang=en;Ispezioni e Monitoraggi con Drone | Alpha Robotix | Pisa;Via Giuseppe Impastato 1 56122 Pisa - Italy;;20112020, 156122;IT02002630503;Alpha Robotix è in grado dieffettuare ispezioni e monitoraggi con drone delle strutture all'interno di impianti industriali: torcie e camini...;filming/imaging, inspection;True;True;https://www.linkedin.com/company/alphaproc;Pisa;False;True;True;1;text extracted and checked and selected;0
https://www.perspicio.it;https://www.perspicio.it;Perspicio srl;Via Fiore   6 83025 Montoro ( AV ) - Italia;info@perspicio.it;+390825503367, https://api.whatsapp.com/send?phone=393924773360, 02855410646;02855410646;Perspicio srl Laser scanning Reverse engineering e prototipizzazione 3D Fotogrammetria aerea e terrestre Rilievi topografici con tecnologia GNSS Termografia Monitoraggi strutturali ed ambientali Utilizzo di droni per rilievi, misure, riprese aeree, accertamenti sullo stato di conservazione di manufatti edilizi, infrastrutture e simili Elaborazioni grafiche in 3D Modelli digitali 3D per l’ingegneria e l’architettura Allestimenti di banche dati personalizzate e sistemi GIS;filming/imaging, inspection;True;True;https://www.youtube.com/channel/UCxkzlNIhW-jZNQ4kK8l-hJA/featured, https://www.facebook.com/perspiciosrl;Avellino;False;True;True;1;text extracted and checked and selected;2014-10-21
https://www.jps-enterprise.com;https://www.jps-enterprise.com;Jps enterprise;;info@jps-enterprise.com;+393386169052, +393386981176;10651310962;Jps enterprise è un'azienda di Milano | Servizi aerei professionali - Corsi certificati per piloti di drone - Consulenze ENAC - Official partner DJI, Parrot, Yuneec e Autel robotics;training, consultancy;True;True;https://www.instagram.com/jpsenterprise, https://www.facebook.com/jpsenterprise.srl, https://facebook.com/jpsenterprise.srl, https://instagram.com/jpsenterprise;Campobasso, Pavia;False;True;True;1;text extracted and checked and selected;2019-01-31
http://droneitalia.net;http://droneitalia.net;Drone Italia - Network di operatori e piloti   riconosciuti ENAC;;info@droneitalia.net;02105440990, 3474747877;02105440990;Produzione Video e Fotografia Aerea con Droni in Liguria, Piemonte, Lombardia e Toscana;manufacturing, filming/imaging;True;False;;Torino;False;True;True;1;text extracted and checked and selected;2015-01-19
https://www.agridroni.it;https://www.agridroni.it;Droni per l'agricoltura, Agricoltura di precisione, Lotta biologica con drone.;Via C . Battisti   19 20027 Rescaldina ( MI ) – Italy, Via C . Battisti   19 - 20027 Rescaldina;info@agridroni.it;+393472430690, https://api.whatsapp.com/send?text=Consulenza%20per%20l%27utilizzo%20dei%20droni%20in%20agricoltura%20-%20https%3A%2F%2Fwww.agridroni.it%2Fconsulenza-per-le-applicazioni-di-droni-sapr-uav-in-agricoltura%2F, 3472430690;12331560156;Droni per l'agricoltura di precisione, Lotta biologica con drone. Mappe di prescrizione, Mappe della variabilità dei suoli, Mappe di vigore;distributing, consultancy, inspection;True;True;https://www.instagram.com/agridroni, https://www.youtube.com/channel/UCRWQ7jromKpsW_bF4Z6L9zg, https://www.facebook.com/agridroni, https://www.linkedin.com/pub/antonio-vigoni/35/8b8/64;Milano;False;True;True;1;text extracted and checked and selected;2014-10-29
https://www.multiopticdrone.com/en;https://www.multiopticdrone.com/en/;Multioptic Drone S.r.l. servizi fotogrammetria aerea rilievo LIDAR con droni;. OPS CRITICHE N° PROTOCOLLO 10531 Multioptic Drone S . r . l . Via Caduti del Mare 20 / A 61011 Gabicce Mare, . 2017 33095 Multioptic Drone S . r . l . Via Caduti del Mare 20 / A 61011 Gabicce Mare, Via Don Minzoni 71 int . 5 – 47841 Cattolica ( RN ) Italy;info@multiopticdrone.com, multiopticdrone@pec.it, davide.diotalevi@multiopticdrone.com, niccolo.ubalducci@multiopticdrone.com;02620640413, +393926698138, 0706201733095, +393493948201;02620640413;Multioptic Drone Srl offre servizi altamente qualificati con Drone fotogrammetria aerofotogrammetria LIDAR da drone termografia agricoltura di precisione;filming/imaging, inspection;True;True;https://www.linkedin.com/company/multioptic-drone, https://www.facebook.com/MultiopticDrone;Pesaro e Urbino, Forlì-Cesena;False;True;True;1;text extracted and checked and selected;2016-06-02
http://www.entoservice.it;http://www.entoservice.it;Entoservice;Viale Combattenti Alleati d’Europa 10 – 45100 Rovigo;info@entoservice.it, rovereto@entoservice.it, amministrazione@entoservice.it, commerciale@entoservice.it, gestioneinterventi@entoservice.it, personale@entoservice.it, entoservice@pec.it;0425423543, 3929964277, 0425415000;;Disinfestazione e Derattizzazione;;True;True;https://www.facebook.com/EntoService, http://www.linkedin.com/company/entoservice-s-a-s-, https://www.facebook.com/entoservice, https://twitter.com/entoservice;Rovigo;False;True;True;1;text extracted and checked and selected;2013-01-09
https://www.skymoles.com;https://www.skymoles.com;SkyMoles – Drone Professional Solutions;Via Ferruccio dell ' Orto 1 | 24126 | Bergamo, Via Ferruccio dell’Orto 1 – 24126 Bergamo;info@skymoles.com, skymolessrls@legalmail.it;04097610168, +393282323556;04097610168;out of these, the cookies that are categorized as necessary are stored on your browser as they are essential for the working of basic functionalities of the website;maintaining, training;True;True;;Bergamo;False;True;True;1;text extracted and checked and selected;2015-09-12
http://sitodiprovadifabietto.weebly.com;http://sitodiprovadifabietto.weebly.com;Servizi e formazione per operatori SAPR (drone) torino;Via Celeste Negarville 10135 Torino ( To ) Italia;;032015, +393338766468;;Formazione per operatori e piloti di SAPR (drone);training;True;True;https://twitter.com/sapritalia, https://www.facebook.com/sapritalia, http://vimeo.com/71809138, http://vimeo.com/user19997151;Torino;False;True;True;1;text extracted and checked and selected;2006-03-29
https://www.quadricottero.com;https://www.quadricottero.com;Quadricottero News;;;01651030098;01651030098;Notizie sui droni, Drone, UAS, Quadricottero, Multirotore, Mezzi Aerei a Pilotaggio Remoto, Operatori Professionali, Riprese Aeree,  Normativa,;filming/imaging;True;True;http://www.facebook.com/Quadricottero, https://twitter.com/Quadricottero, https://www.youtube.com/channel/UCEi__0ns1_eapRB6KpJ00Wg, https://www.facebook.com/Quadricottero, https://plus.google.com/communities/109009853492762737507;Roma;False;True;True;1;text extracted and checked and selected;2011-03-17
https://archivio.romadrone.it;https://archivio.romadrone.it;Roma Drone - Archivio;Via Pistoia   7 00182 - Roma ( RM ) Italy;;0645476584, 08444871001;08444871001;roma drone conference 2019;training;True;False;https://www.youtube.com/channel/UC97tCc3p8rtrue2uf54T9PQ, https://www.linkedin.com/company/11000064, https://www.facebook.com/romadrone, https://twitter.com/RomaDrone;Roma;False;True;True;1;text extracted and checked and selected;2013-12-20
https://www.aerokomp.com;https://www.aerokomp.com;AeroKomp - Home;Via Faedis 21   33040 Povoletto;adi@aerokomp.com;02917680304, +393247878376;02917680304;#;;True;True;https://www.facebook.com/AeroKomp-166568540702980, https://www.instagram.com/accounts/login;Udine;False;True;True;1;text extracted and checked and selected;2018-03-18
http://www.skyrobotic.com;http://www.skyrobotic.com;Skyrobotic | Remotely Piloted Aircraft System (RPAS);Strada dello Stabilimento   1 05035 - Nera Montoro Narni, Strada dello Stabilimento   1 05035 – Nera Montoro Narni;info@skyrobotic.com, redazione@italeaf.com, sales@skyrobotic.com, support@skyrobotic.com;3907447581, 01520320555, 07447581, +3907447581;01520320555;any cookies that may not be particularly necessary for the website to function and is used specifically to collect user personal data via analytics, ads, other embedded contents are termed as non-necessary cookies;design, entertainment/race;True;True;https://www.linkedin.com/company/skyrobotic, https://www.facebook.com/skyroboticitalia, https://twitter.com/skyrobotic, http://vimeo.com/user34162897, https://www.youtube.com/channel/UCFvzYqYUJFyaNXHZcFXWT6g, https://plus.google.com/+SkyroboticSPANarni, https://twitter.com/Skyrobotic;Terni;False;True;True;1;text extracted and checked and selected;2013-12-20
https://www.ibtimes.com/italy-permits-armed-us-drones-fly-out-sigonella-air-base-attacks-against-isis-2318872;https://www.ibtimes.com/italy-permits-armed-us-drones-fly-out-sigonella-air-base-attacks-against-isis-2318872;Italy Permits Armed US Drones To Fly Out Of Sigonella Air Base For Attacks Against ISIS;. 7   2011 Photo : REUTERS / Win McNamee / Pool Italy;;022316;;Italian officials have been apprehensive about allowing American drones to carry out offensives from its Sicilian base, fearing potential blame for civilian casualties.;;True;True;https://www.facebook.com/IBTimes, https://www.linkedin.com/company/ibt-media, https://twitter.com/ibtimes, http://www.twitter.com/VishakhaNS;;False;True;True;1;text extracted and checked and selected;2005-12-12
https://www.dronissimo.it;https://www.dronissimo.it;Dronissimo: Shop On-line dedicato a Droni Gimbal e Accessori - Dronissimo;Via Tavolaro   21 - 87100 Cosenza ( Italy;info@profserv.it, s.lombardo@profserv.it, e.toteda@profserv.it, s.veltri@profserv.it, m.aiello@profserv.it, g.lombardo@profserv.it, m.deluca@profserv.it, a.liparoti@profserv.it, s.deluca@profserv.it;02229140781, +39098421235, +39098421412;02229140781;Tutto ciò che serve per le tue riprese non convenzionali. Droni professionali Gimbal e accessori DJI Parrot Yuneec;sales, filming/imaging, components;True;True;https://www.facebook.com/profserv.it, https://www.instagram.com/professional_service_srl;Cosenza;False;True;True;1;text extracted and checked and selected;2016-01-16
https://www.airabruzzo.com;https://www.airabruzzo.com;airabruzzo;Via Raiale   285 - 65128 Pescara Sede Legale : Via Bologna   46 - 65121 Pescara;info@airabruzzo.com;02096460684, 3440467928;02096460684;Servizi aerei a pilotaggio remoto;training, inspection;True;False;https://www.linkedin.com/company/25167477/admin, https://www.facebook.com/pages/Air-Abruzzo/955379577811825, https://www.youtube.com/channel/UCcR2CrKrsq_uKQB4Vlm9dAQ;Pescara;True;True;True;1;text extracted and checked and selected;2014-09-02
https://degeaitalia.wixsite.com/degea;https://degeaitalia.wixsite.com/degea;DEGEA | Droni & Agricoltura di Precisione;Via Fontanelle Santo Stefano 3 37129 Verona;lucaleati@gmail.com;+393497294287, 337129;;Con DEGEA | Agricoltura di Precisione | Fai crescere la tua Azienda Agricola, diminuendo gli sprechi e aumentando la produzione! Scopri come...;manufacturing;True;True;;Verona;False;True;True;1;text extracted and checked and selected;2012-05-08
https://www.mainstreamagency.it;https://www.mainstreamagency.it;Mainstream Agency;. IVA : IT14287921002 - 00133   Roma   Italia;;3497494871, https://api.whatsapp.com/send?text=Pubblicit%C3%A0%20sui%20Social%20%28Facebook%20e%20Instagram%29%20-%20https%3A%2F%2Fwww.mainstreamagency.it%2Fonline%2Fpubblicita-social%2Fperche-fare-pubblicita-sui-social-facebook-e-instagram%2F, 393497494871, +393497494871;IT14287921002;I am online;sales;True;True;https://www.facebook.com/dlyitaliashop, https://www.instagram.com/officinekosmetike, https://www.instagram.com/peevishlab, https://www.facebook.com/pg/QueenHelenaShoes, https://www.facebook.com/pinup.pinup.58, https://www.facebook.com/trendyroma, https://www.facebook.com/homefit.caseroma, https://www.facebook.com/Mosetti.Ivan, https://www.instagram.com/dly.italia, https://www.facebook.com/Massima-Tutela-102503391127212, https://www.instagram.com/myd.italia, https://www.instagram.com/dennyroseroma, https://www.facebook.com/newconsultingsrls, https://www.facebook.com/drone24hours, https://www.instagram.com/homefit.caseroma, https://www.facebook.com/mainstreamwebagency, https://www.instagram.com/ivanmosetti.mainstream, https://www.instagram.com/pinup.shoes, https://www.instagram.com/drone24hours, https://www.facebook.com/wom.man.it.fashion, https://www.instagram.com/mainstreamagency.it, https://www.instagram.com/wom.man.it, https://www.instagram.com/queenhelenashoes, https://www.linkedin.com/in/ivan-mosetti-479ab89b, https://www.facebook.com/officinekosmetike, https://www.facebook.com/myd.fashion, https://www.youtube.com/channel/UC-fPYjgq4k_JAvi9B-nRBVg;Roma;True;True;True;1;text extracted and checked and selected;2019-10-16
http://www.geometrastefanobergamini.it;http://www.geometrastefanobergamini.it;Home Page;Via Grazia n . 4 - 40050 - Funo di Argelato ( BO ) Iscritto all ' albo dei Geometri di Bologna;geom.stefano.bergamini@gmail.com;3479571544, 05119901685, 02943731204, 0510510375;02943731204;studio tecnico geometra stefano bergamini;;True;True;https://it.linkedin.com/in/stefano-bergamini-b34731a2;Pistoia;True;True;True;1;text extracted and checked and selected;2015-12-12
https://geoapp-italia.com;https://geoapp-italia.com;Home;quindi facciamo ogni sforzo per immaginare profondamente la tua idea . new _ icons-2 Re, . 152 / 2006 Re;info@geoapp-italia.com;+390245381960;;i tecnici qualificati della geoapp italia seguono i lavori in ogni loro fase e ascoltano, in una fase preliminare, tutte le esigenze della clientela per soddisfarne le necessità relative al proprio settore di riferimento;;True;True;;Verbano-Cusio-Ossola;True;True;True;1;text extracted and checked and selected;2014-04-02
https://www.nemeasistemi.com;https://www.nemeasistemi.com;Nemea Sistemi | Sistemi informativi territoriali e geografici;Via Mazzini   78 07041 Alghero Sardegna ITALIA;info@nemeasistemi.com, nemea.sistemi.srl@pcert.it;+390794801861, +390184872105, 02897110041, +3901841955077;02897110041;NeMeA Sistemi è un’azienda Italiana che opera dal 2002 nel campo dei sistemi informativi territoriali (SIT) e geografici (GIS).;inspection, distributing;True;True;https://www.facebook.com/NeMeASistemi, https://www.linkedin.com/company/nemeasistemi, https://www.youtube.com/channel/UC7gr3DOdPzztvvGIG892zig;;False;True;True;1;text extracted and checked and selected;2002-09-27
https://www.librasapr.com;https://www.librasapr.com;LIBRA;Via Jacopo Chimenti 14   50142 Firenze, Via Jacopo Chimenti 14 50142 Firenze, Via Chimenti 14   50142 Firenze;librasapr@pec.it, librasapr@gmail.com;005815, +393297625520, 005817, 06841570481;06841570481;Flying for environment;inspection;True;True;https://www.facebook.com/FlyingForEnvironment, https://www.linkedin.com/company/librasrl;Firenze;True;True;True;1;text extracted and checked and selected;2018-09-28
https://www.drone-store.it;https://www.drone-store.it;Vendita Droni Online e Accessori;Via Pedonale Isarco n . 5 – 20847 Albiate ( Monza, Via Pedonale Isarco n . 5 - 20847 Albiate;;3474333302;IT08844430960;"[box_section icon_theme=\retinaicon-font:retina-the-essentials-050\"" icon_size=\""30\"" color=\""#7caf00\"" border_size=\""0\"" title=\""PAGAMENTI SICURI CON PROTOCOLLI…""";sales, components;True;True;https://www.instagram.com/drone_emotions, https://www.facebook.com/djitutorials, https://www.youtube.com/user/dronemotionsweb, https://it.pinterest.com/dronemotions, https://www.facebook.com/dronemotions, https://www.linkedin.com/company/drone-emotions-srl;Milano;False;True;True;1;text extracted and checked and selected;2017-08-28
https://www.sersicurezzaitalia.it;https://www.sersicurezzaitalia.it;s.e.r. Italia Safety & Emergency Response s.e.r. Italia, SER;Via Babbaurra   28 / B 93017 San Cataldo ( CL ) Italia;sersicurezzaitalia@pec.it, emergenza@sersicurezzaitalia.it, info@sersicurezzaitalia.it, amministrazione@sersicurezzaitalia.it, formazione@sersicurezzaitalia.it, soccorsoindustriale@sersicurezzaitalia.it, lavoro@sersicurezzaitaia.it, supporto@safetywebsolutions.it;https://api.whatsapp.com/send?phone=393516671277&text=Richiesta%20contatto%20Emergenza%20Industriale, https://api.whatsapp.com/send?phone=393317256625&text=Richiesta%20contatto, 02018640850, +393317256625, 3516671277;IT02018640850, 02018640850;s.e.r. Italia Safety Emergency Response: Sicurezza e Risposta all'Emergenza. Spazi Confinati e Lavori in quota. Soccorso Industriale. Squadra emergenza.;filming/imaging;True;True;https://www.youtube.com/channel/UC-14SuBtm3-JsYACsBi0RGg, https://www.linkedin.com/company/s.e.r.-italia-safety-&-emergency-response, https://twitter.com/SerSicurezza, https://www.facebook.com/sersicurezzaitalia, http://instagram.com/alfamiketango2;Caltanissetta;True;True;True;1;text extracted and checked and selected;2016-10-28
https://www.costruzionedroni.it;https://www.costruzionedroni.it;Costruzionedroni.it - FPV Drone Racing;;info@costruzionedroni.it;390116998016, http://whatsapp://send?text=https%3A%2F%2Fwww.costruzionedroni.it%2Fruncam-racer-3-1000tvl-super-wdr-crystal-clean, +390116998016, 3006001200;12450390013;Costruzionedroni.it - FPV Drone Racing è un sito di riferimento per Flight Controller, Frame, ESC, Motori, VTX, Antenne, PDB, Action Cam, Radiocomandi, Riceventi, Eliche, Stazioni saldanti.;components, distributing;True;True;;Torino;True;True;True;1;text extracted and checked and selected;2016-04-04
http://www.drivedrone.it;http://www.drivedrone.it;Drive Drone;Via Napoli 67   71122 - Foggia;info@drivedrone.it, geom.carmine.bevilacqua@gmail.com;3802499348, 3995750712, 003251, +393802499348;IT03995750712;Il Geometra Carmine Bevilacqua, certificato dall'ENAC con n. I.APRA.003251, specializzato in rilievi con APR in contesto ambientale, zone critiche e non critiche;inspection;True;False;;Foggia;True;True;True;1;text extracted and checked and selected;2020-10-14
https://www.unikey.it;https://www.unikey.it;Home - Unikey;Via Papiria   50 | 00175 Roma;;0687860121;IT15028061008;fornitura di risorse in time & material su tecnologie java/;;True;True;https://www.facebook.com/Unikey-Srl-497003291105716, https://www.linkedin.com/company/unikeysrl;Roma;True;True;True;1;text extracted and checked and selected;2018-11-30
https://www.dronebee.it;https://www.dronebee.it;DroneBee | Agricoltura Intelligente;Via Fiume 11   50123 Firenze, Via Fiume 11 50123 Firenze;info@dronebee.it;3341611876, 0909985, 06751440485;06751440485;Cosa offre DroneBee  per monitorare globalmente i campi  per monitorare nel dettaglio le colture  per caratterizzare i suoli  per determinare il numero di piante e le fallanze  per malattie, resa, fenologia e stress idrici  per ottimizzare concimazione e trattamenti  per rilievi;inspection;True;True;https://twitter.com/dronebeeag, https://it.linkedin.com/company/dronebee, https://www.facebook.com/dronebeeag, https://www.youtube.com/channel/UCcnAxyDOIUbxNhuTzf2KjXQ, https://www.instagram.com/dronebeeag, https://www.linkedin.com/in/simon-paolo-kartsiotis-a7bb7584, https://www.linkedin.com/in/niccol%C3%B2-bartoloni-30447719, https://www.facebook.com/people/Niccol%C3%B2-Bartoloni/777864790;Firenze;True;True;True;1;text extracted and checked and selected;2016-05-03
https://www.droneserviceitaly.com;https://www.droneserviceitaly.com;Noleggio Droni e R.O.V. Subacquei Professionali - EZIO DENTI SRL;Via Carlo Rainoldi 10 21100 Varese   Italia Hangar Elisuperficie Privata Via Ferriera 15 21018 Sesto Calende ( Varese )   Italia, Via F . del Cairo 26 - 21100 - Varese - Italy, Via Carlo Rainoldi   10 21100 Varese   Italia, Via F . del Cairo 26 21100 Varese   Italia;droni@eziodenti.com;+393487121955, 08337150968, 02793340122;08337150968, 02793340122;(+39) 348.712.1955 Invia Email (+39) 348.712.1955 Soluzioni Aeree di nuova generazione Invia Email (+39) 348.712.1955 Soluzioni Aeree di nuova generazione Invia Email Soluzioni Aeree di nuova generazione Portiamo il tuo lavoro a quote sempre più alte Oltre 35 anni di esperienza La EZIO DENTI S.R.L. è una società aeronautica con oltre 35 anni di esperienza+ Read More;renting;True;True;;Varese;False;True;True;1;text extracted and checked and selected;2021-05-27
https://www.microgeo.it/it/default.aspx;https://www.microgeo.it/;Laser Scanner 3D, termografia, fotogrammetria, droni | MicroGeo;Via del Consorzio 21   Falconara Marittima 60015 – Ancona;info@microgeo.it;3801459116, 3357081199, 3355249880, 3483735838, 3397800356, 337238436, 3351226824, 3201420269, 05256310482, 0558954766, 3356155743, 0558952483, 0687738755, 3282243212;05256310482;Laser scanner 3D, termografia, fotogrammetria, droni professionali: MicroGeo offre soluzioni per il rilievo, misura e prove non distruttive!;filming/imaging, inspection;True;True;https://www.facebook.com/pages/Microgeo-srl/182134875172326, https://it.linkedin.com/company/microgeo-srl, https://instagram.com/microgeo_srl, https://www.youtube.com/channel/UC52Ff8FIN96TB-Ep1-yUfqg, https://twitter.com/Microgeosrl;Ancona;True;True;True;1;text extracted and checked and selected;2002-09-24
https://www.umbriadronevision.com;https://www.umbriadronevision.com;Fotografia Aerea | Umbria Drone Vision | Italy;. Pontani 3   Perugia   Italy;umbriadronevision@gmail.com;3475769583, 3513840540;IT03513840540;Fotografia con drone. Umbria drone vision. Aerial Photography;filming/imaging;True;False;https://www.instagram.com/umbriadronevision, https://www.facebook.com/Umbria-Drone-Vision-100300605401833;Perugia;False;True;True;1;text extracted and checked and selected;2021-01-13
https://www.aerohabitat.org;https://www.aerohabitat.org;A E R O H A B I T A T Centro Studi;. Box ) CP 182 - 00125 Roma;;330300, 340541, 311097, 340451, 3856251008, 03856251008, 320200, 340500;;"te renzo dentesanorubrica: \atc batter\"" - airspace\""cold case\"" aeronautici italianidossier: cold case cessna 650 di trigoriarubrica: anacna - flash forwardbriefing aerohabitatsafety alert di aerohabitatlinate 8 ottobre: l'altra inchiestaenac - ansvaviation topicssafety - securitypiano di rischio aeronauticologin""";;True;True;;Roma;True;True;True;1;text extracted and checked and selected;0
https://easydroni.it;https://easydroni.it;EASY DRONI riprese aeree, riprese con drone, corso APR, corso drone BS;Via Eritrea   36 - Brescia   Italia 25126 assistenza @ ilredellhobby . it 030 5232423 3487092772 SEDE FORMATIVA : Via Cassala   60 - Brescia;assistenza@ilredellhobby.it, info@easy-consult.it;30042014, 3487092772, 0305332423;;riprese aeree, ispezioni con drone, video drone, foto aeree, corsi APR, corso drone Brescia, vendita droni, assistenza droni, pilota drone, certificazione enac;sales, training, filming/imaging;True;False;;Brescia;False;True;True;1;text extracted and checked and selected;2018-03-24
https://seadrone.it;https://seadrone.it;Sea Drone Tech Summit 2019 - Pagina iniziale;Via San Castulo   4 - 00182 Roma RM ( Italy;segreteria.presidente@seadrone.it, segreteria@seadrone.it, commerciale@seadrone.it, seadrone.ufficiostampa@mediarke.it;08444871001, 0645476584, 30102019;08444871001;il congresso “sea drone tech summit 2019” sarà trasmesso in diretta streaming sul canale online di drone channel;filming/imaging, entertainment/race;True;True;https://www.facebook.com/Seadrone.it, https://twitter.com/SeaDrone2018;Roma;False;True;True;1;text extracted and checked and selected;2018-03-09
http://www.modelgiochi.eu;http://www.modelgiochi.eu;Modelgiochi.eu, Il tuo negozio di modellismo di fiducia;: Spedizioni e Pagamenti Copyright © 2022 MODELGIOCHI DI DE POI LUCIANO   VIA MOLINERA   7 - 31012 CAPPELLA MAGGIORE TV - Italia;info@modelgiochi.it;3296245232, 3161370261, 0438941748, 03161370261;03161370261;Modelgiochi.eu :  - KIT PLASTICA, MODELLI GIOCATTOLO, ATTREZZI/UTENSILI, METALLI/PLASTICHE, LEGNAME, AEROMODELLISMO RC, AUTOMODELLISMO RC, NAVI LEGNO, ACCESSORI FISSAGGIO, BATTERIE, VITERIE, VIDEOCAMERE, MOTORI A SCOPPIO, MISCELE/LUBRIFICANTI, MINI 4WD, ELICOTTERI, KIT FACILI, RADIOCOMANDI, FERMODELLISMO, AQUILONI, OUTLET-OCCASIONI, LIBRI, MODELLI RC VARI, GADGET, ELETTRONICA, SLOT, MOTORI ELETTRICI, CARICABATT/ALIMENT., VETRINE/ESPOSITORI, COLORI, KIT LEGNO/MATTONI, RICAMBI OPTIONAL CAR, COLLEZIONISMO, QUADRICOTTERI/DRONI, CAVETTERIA, CUSCINETTI, COLLE/RESINE, GIOCOLERIA, AEREI DIE CAST, NEWSLETTER, e-commerce, modellismo, online shopping, Vittorio, Veneto, Treviso, aeromodelli, elicotteri;sales, filming/imaging, components;True;True;https://www.facebook.com/pages/Modelgiochi/253367884680208;Treviso;False;True;True;1;text extracted and checked and selected;2022-02-21
https://www.nwservice.it;https://www.nwservice.it/it/;North West Service - Compagnia Aerea Elicotteri;Via Stefano Bruda   33 10080 Busano;info@nwservice.it;+390124422018, +393392559900, 3310080;IT09014490016;North West Service, con sede in provincia di Torino, è scuola di volo specializzata nella formazione di piloti di elicottero e droni, lavori aerei e trasporto passeggeri. Scopri i nostri servizi;training;True;False;https://www.youtube.com/channel/UCCe9gEptbi0zvrAPe6h2khQ, https://www.instagram.com/nwservice, https://www.facebook.com/NWService;Torino;True;True;True;1;text extracted and checked and selected;2002-03-20
