org_url;url_visited;name;address;email;phone;VAT;description;activities;boolDrone;eCommerce;socialMedia;region;jobs;inCountry;isCompany;isSelected;action;created
https://studioscalisi.com;https://studioscalisi.com;Home Page;;;3270543695, +39095437500, 095437500, 3721260879, 304202109, 31101990, 03721260879, 095921616, 304306, +393270543695;03721260879;Rilievi topografici, catasto, geometra, gps, infortunistica, CTU, CTP,laser scanner,finanziamenti fondo perduto,ricostruzione cinematica del sinistro,picchettamento,pregeo,docfa,volture,agenzia del territorio,analisi cartografica del territorio catasto,scalisi geometra randazzo,polizze agricole,Sai,cattolica assicurazioni,HDI,genertel,prestipoint,fidelizazzione,generali,modulo c.a.i.,drone rilievo,droni futuro,evoluzione,rc condominio,assicurazioni condominio,lotto super,grandine,gelo/brina,sbalzo termico,siccità,colpo di sole,tromba d'aria,rc professionale,rimborso comunità europea,parametro ministeriale,geometra,rilevo topografico,lavoro publico,rilievo topografico,rilievo drone,rilievo celerimetrico,normativa catastale,c.t.u,consulenza tribunale catania,bronte,randazzo,linguaglossa,aci bonaccorsi,aci castello,aci catena,aci sant'antonio,acireale,adrano,belpasso biancavilla,bronte,calatabiano,biancavilla,caltagirone,camporotondo etneo,castel di iudica castiglione di sicilia,fiumefreddo,giarre,grammichele,gravina di catania,licodia eubea,maletto,maniace,mascalucia,mazzarrone,militello in val di catania,milo,mineo,mirabella imbaccari,misterbianco,mottasant'anastasia,nicolosi,palagonia,paterno',pedara,piedimonte etneo,raddusa,ragalna,ramacca,riposto,san cono,san giovanni la punta,san gregorio,san pietro calrenza,santa venerina,sant'agata li battiati,sant'alfio,scordia,trecastagni,tremestieri etneo,viagrande,valverde,vizzini,zafferana etneaGEOMETRA   SCALISI  ANGELO 3270543695  CARMELO  ALFREDO INFORTUNISTICA STRADALE celerimetrico ctu bronte randazzo linguaglossa adrano RILIEVO TOPOGRAFICO belpasso biancavilla GIS astiglione di sicilia RICOSTRUZIONE CINEMATICA DEL SINISTRO giarre FRAZIONAMENTO  catania CATASTO maletto maniace DRONE milo docfa pregeo 095-921616 ETNA   mediazione civile  CATASTO piano quotato CURVE DI LIVELLO uva por pon apre CATASTAMENTO DTM  energie alternative PLANIMETRIA mediazione civile CERTIFICAZIONE ENERGETICA regione sicilia provincia regionale di catania GOLE ALCANTARA parco nebrodi madonie ORTOFOTO perito disbrigo pratiche  terrazzamento vigneto  BUROCRAZIA zonizazzione PERIZIA calderara GPS perizia sinistro risarcimento Real-time access to databases of the Territory throughout Italy for cadastral surveys, certificates, historical, floor plans, maps, cadastral transcription notes, registration, recordation, deeds, etc.. <br />Real-time access to databases of the Public Motor Vehicle Registry for searches and research <br />Real Estate Consulting: by experts and collaborators propose, buy and sell real estate and commercial activities. <br />Legal Advice: via legal advisor, he provides advice and legal assistance in civil matters <br />Consulting Notary: notary trust, lend all notarial services.<br />SURVEYOR SCALISI ALFREDO ANGEL 3270543695 CARMEL ROAD ACCIDENT celerimetric ctu Bronte randazzo linguaglossa adrano TOPOGRAPHIC belpasso biancavilla GIS astiglione Sicilian RECONSTRUCTION OF CINEMATIC LEFT giarre Catania LAND maletto maniace DRONE milo Docfa Pregeo 095-921616 ETNA LAND civil mediation plan listed CURVE LEVEL DTM alternative energy PLAN civil mediation ENERGY CERTIFICATION region sicily regional province of Catania ALCANTARA GORGES park nebrodi madonie ORTHOPHOTO expert document procedures terraced vineyards BUREAUCRACY zonizazzione calderara GPS expertise left risarcimento,DTM,Classifica parole chiave con cui siamo stati trovati<br />Prezziario topografia,Costo rilievo topografico,Prezziario rilievi topografici,Calcolo parcella rilievo topografico,Rilievi topografici speciali ,Rilievi topografici catania,Tariffe topografia,Aerofotogrammetria cataniaTariffe rilievi topografici,Prezzi rilievi topografici,Costi rilievi topografici Tariffa rilievi topografici,Aerofotogrammetria mascali,Rilievi topografici sicilia,Tariffario rilievi topografici ,Parcella rilievo gps Rilievi topografici,Tariffe lavori topografici ,Tariffe topografi,Costo rilievi,Parcella rilievi topografici,Prezzario lavori topografici,Prezzario rilievi topografici, Prezzi rilievo topografico,Prezziario rilievo ,Prezzo rilievo topograficoRilievo topografico costo,Tariffa lavori topografici,Tariffa rilievo topografico,Prezzario topografico, Prezziario topografo,Tariffario rilievo gps.Calcolo tariffa rilievi topografici,Parcelle rilievi topografici,Prezziario rilievi gps,Tariffa rilievi gps,Costo rilievi gps,Costo rilievi topografici,Parcella rilievo topografico,Costo rilievo gps,Costo topografo,Prezzi gps, opografici,Elenco prezzi rilievi topografici,Tariffe per rilievi,Gps. topografico prezzo ,www.studioscalisi.com,Onorario topografo,Tariffa rilievo topografico gps,Parcella per rilievi topografici,Prezzario rilievo topografico,Prezziario topografico,Attrezzature topografiche,Calcolo parcella per,rilievi gps,Parcella per. rilievo gps,arcella topografo ,Rilievi gps tariffe ,Rilievo topografico gps,Tariffe topografo,Compensi per. rilievi topografici ,Prezzario rilievi,Prezzario topografo,Prezzi aerofotogrammetria,Prezzo rilievo gps,Rilevamenti topografici speciali,Rilievi topografici prezzi,Corso rilievo topografico,Rilievi topografici tariffe,Studi tecnici provincia catania Costi rilievo gps ,Topografia Costi topografia<br />Costo gps per rilievo topografico Costo per. rilievo gps.Costo rilievo topo,Prezziario rilievi,Richiesta lavori topografici,Rilievi gps sicilia 2<br />Rilievi topografici costi,Rilievi topografici prezziario ,Gps per rilievi,Gps per rilievi topografici,Gps per rilievi topografici prezzi <br />geometra,rilevo topografico,lavoro publico,rilievo topografico,rilievo drone,rilievo celerimetrico,normativa catastale,c.t.u,consulenza tribunale catania,bronte,randazzo,linguaglossa,geometra di cantiere,consulenza del lavoro,divisione erditaria, successione ereditaria,rilievo stazione ferroviaria,rilievo fabbricati fantasma dl 78/2010, rilievo architettonico,rilievo fotogrammetrico,rilievo gis,appalti,rilievo geologico,rilievo laser scanner,rilievo concordia torre del giglio,rilievo lidar,docfa, pregeo,modello f26,docte,misurate punti fiduciali PF,sinergia tra tecnici,agrimensura,horizon 2020, apreAgrigento.Alessandria,Ancona,Aosta,Arezzo,Ascoli Piceno,Asti,Avellino,Bari,barletta-Andria-Trani,Belluno,Benevento,Bergamo,Biella, Bologna,Bolzano,Brescia,,Brindisi,Cagliari,Caltanissetta,Campobasso,Carbonia-Iglesias,caserta,,Catania,Catanzaro,Chieti,Como,Cosenza,Cremona,Crotone, Cuneo,Enna,fermo,Ferrara,Firenze,Foggia,Forlì-Cesena ,frosinone,Genova ,Gorizia,Grosseto, Imperia,Isernia,La Spezia ,L'Aquila,Latina Lecce, Lecco Livorno,Lodi ,Lucca,Maceratam,Mantova,Massa-Carrara , Matera,Messina,Milano,Modena.Monza e della Brianza Napoli,Novara,Nuoro  Olbia-Tempiom,Oristano ,Padova,Palermo,Parma ,Pavia,Perugia,Pesaro e Urbino,Pescara,Piacenza,Pisa,Pistoia,Pordenone,Potenza,Prato,Ragusa,Ravenna,Reggio Calabria ,Reggio Emilia,Rieti Rimini,RomaRovigo,Salerno,Medio Campidano  Sassari,Savona,Siena,siracusa,Sondrio,Taranto,Teramo,Terni,Torino,  Ogliastra,Trapani,Trento ,Trevise,Trieste,Udine,Varese,Venezia,Verbano-Cusio-Ossola,Vercelli,Verona,Vibo Valentia ,Vicenza,viterbo,Aci Bonaccorsi,Aci Castello, Aci Catena, Acireale, Aci Sant'Antonio, Adrano,Belpasso,Biancavilla,Bronte,Calatabiano, Caltagirone,Camporotondo Etneo, Castel di Iudica,  Castiglione di Sicilia, Catania, Fiumefreddo di Sicilia, Giarre,Grammichele, Gravina di Catania,Licodia Eubea, Linguaglossa,.    Maletto, Maniace, Mascali, Mascalucia, Mazzarrone, Militello in Val di Catania,Milo, Mineo, Mirabella Imbaccari,Misterbianco, Motta Sant'Anastasia, Nicolosi, Palagonia, Paterno',Pedara,Piedimonte Etneo,Raddusa, Ragalna, Ramacca, Randazzo, Riposto, San Cono,San Giovanni la punta, San Gregorio di Catania, San Michele di Ganzaria, San Pietro Clarenza, Sant'Agata li Battiati,Sant'Alfio, Santa Maria di Licodia, Santa Venerina,    Scordia, Trecastagni,Tremestieri Etneo,Valverde, Viagrande,Vizzini,   Zafferana Etnea-frana-dissesto-idrogeologico-DJI Phantom 4,DJI Phantom 3 Advanced,Yuneec Typhoon Q500 4K ,DJI Ronin-M,Matrice 100,Inspire 1,DJI Inspire 1 PRO Black Edition,DJI Inspire 1 Raw con 2 ,DJI Zenmuse X5,DJI Zenmuse X5 Gimbal e Camera ,Bebop Drone,Bebop Skycontroller,Walkera Drone QR Y100 con ,Walkera Runner 250 RTF 3 con ,Walkera F210 RTF con Radio e ,Brushless ,Siracusa,Cassaro,Buscemi,Buccheri,Ferla,Portopalo di Capo Passero,Canicattini Bagni,Solarino,Sortino,Palazzolo Acreide,Priolo Gargallo,Francofonte,Melilli, Carlentini,Rosolini,Pachino,Floridia,Noto,Lentini,Avola,1-PROLUSIONE 01 2-PROLUSIONE 02 3-STRUMENTI 1 4-STRUMENTI 2 5-STRUMENTI 3 6-TEODOLITE 7-TEODOLITE DISTANZIOMETRI STRUMENTI INTEGRATI 8-LIVELLO 9-PROBLEMA CARTOGRAFICO 10-GEOIDE E STORIA 11-CARTA DI GAUSS 12-INSERIMENTO MISURE IN CARTA GAUSS 13-INQUADRAMENTO ALTIMETRICO 14-IL SISTEMA GPS 15-RILIEVO TOPOGRAFICO 16-ANGOLI DI DIREZIONI 17-RILIEVO TOPOGRAFICO BIS 18-CARTOGRAFIA ITALIA 19-DALLA CARTOGRAFIA TRADIZIONALE ALLA CARTOGRAFIA NUMERICA 20-STRUMENTAZIONE DATI 1 21-STRUMENTAZIONE DATI 2 22-METODI DI PRODUZIONE 23-MODELLI FISICI 24-OPERAZIONI TOPOGRAFICHE 25-METODI TOPOGRAFICI PER CONTROLLO E COLLAUDO GRANDI STRUTTURE-gru-sollevamento-carichienergie rinnovabile, energie pulite, pale eoliche,l'energia eolica,venti d'alta quota,parchi eolici,I primi sfruttamenti per generare potenza elettrica, L'energia eolica,Distribuzione della velocità del vento,Venti d'alta quota,Parchi eolici,Eolico on-shore e near-shore,Eolico off-shore,Minieolico e microeolico,Eolico d'alta quota,   Turbina eolica,Generatore ad asse orizzontale, Principali componenti,Generatore ad asse verticale,Eolico magnetico,Capacità di energia eolica e produzione,rend di crescita,Fattore di capacità,Penetrazione, Variabilità,Prevedibilità,Affidabilità,Accumulo dell'energia,Effetti sull'ambiente,Efficienza,Economia,Trend dei costi,Incentivi e benefici di comunità,Politica,Governi centrali,Opinione pubblica,Comunità Costi mini-eolico,   Costi micro-eolico,Note, BIbliografia,Voci correlate,Altri progetti,Collegamenti esterniBarcellona Pozzo di Gotto,Milazzo,Patti,Capo d'Orlando<br />Sant'Agata di Militello,Lipari,Taormina,Giardini-Naxos,Santa Teresa di Riva,Villafranca Tirrena,Torregrotta,Terme Vigliatore,San Filippo del Mela,Gioiosa Marea,Rometta<br />Tortorici,Pace del Mela,Brolo,Acquedolci,Spadafora,Mistretta,Santo Stefano di Camastra,Santa Lucia del Mela,Capri Leone,Torrenova,Roccalumera,Saponara,Francavilla di Sicilia,Piraino,Venetico<br />Naso,Furnari,San Fratello,Nizza di Sicilia,Caronia,Furci Siculo,Capizzi,Gaggi,Castell'Umberto,Sant'Angelo di Brolo,Tusa,San Piero Patti,San Pier Niceto,Letojanni,Monforte San Giorgio,Falcone,Sinagra,Galati Mamertino,Alì Terme,Castroreale,Cesarò,Merì,Montalbano Elicona,Oliveri,Scaletta ZancleaRodì Milici,San Marco D'Alunzio,Alcara Li Fusi,Gualtieri Sicaminò,Savoca,Librizzi<br />Itala,Montagnareale,Mazzarrà Sant'Andrea,Sant'Alessio Siculo,Graniti,Longi,Ficarra,Fiumedinisi,San Teodoro,Novara di Sicilia,Pettineo,Valdina<br />Militello Rosmarino,Castel di Lucio,San Salvatore di Fitalia,Pagliara,Roccavaldina,Castelmola,Ucria,Raccuja,Fondachelli-Fantina,Santa Domenica Vittoria,Mirto,Malfa,Santa Marina Salina,Antillo,Forza d'Agrò,Tripi,Casalvecchio Siculo,Limina,Motta Camastra,Reitano,Alì,Motta d'AffermoMalvagna,Frazzanò,Moio Alcantara,Leni,Roccella Valdemone,Basicò,Mandanici,Mongiuffi ,monitoraggio,amianto drone,droni;manufacturing, filming/imaging, inspection, components;True;True;https://vimeo.com/173457083, https://it.pinterest.com/studiotecnico_s;Torino, Trapani, Rimini, Catania, Trento;True;True;True;1;text extracted and checked and selected;2007-08-21
https://flyingbasket.com;https://flyingbasket.com;FlyingBasket | Drones that can transport heavy loads to remote places;Via Scurcia 54   39046 Ortisei ( BZ ) | Headquarters : Via Enrico Fermi 27   39100 Bolzano / Bozen;info@flyingbasket.com, applications@flyingbasket.com;+3904711726609, 02868860210;02868860210;FlyingBasket is a company based in the Italian Alps which is specialized in the production of transport and logistics drones for heavy payloads up to 100kg.;components;True;True;https://www.instagram.com/flyingbasket, https://www.facebook.com/flyingbasketaviation, https://it.linkedin.com/company/flyingbasket, https://linkedin.com/company/flyingbasket;Bolzano-Bozen;False;True;True;1;text extracted and checked and selected;2009-08-27
http://p1hh.piaggioaerospace.it;http://p1hh.piaggioaerospace.it;Piaggio Aerospacespace - P.1HH HammerHead;Viale Generale Disegna 1   17038 Villanova d’Albenga   Savona   Italy;p.1hh@piaggioaerospace.it;+15612530104, 3748280108, +390182266050;IT03748280108;1hh hammerhead features a technologically advanced vehicle control & management system (vcms) that when combined with the advanced mission management system (mms) manages the uav and its mission specific equipment;;True;False;;Savona;False;True;True;1;text extracted and checked and selected;2014-07-02
https://www.afdrones.it;https://www.afdrones.it;Home - AF Drones;Via Porro   46   25048 Edolo;;04241560988, 3498653797;;[...]Leggi di più...;filming/imaging;True;True;https://www.linkedin.com/company/af-drones, https://www.youtube.com/channel/UCcWCNdVnbb0mQ9TgDeHvBvQ, https://www.facebook.com/AF.Drones.Pro, https://www.instagram.com/af_drones;Brescia;True;True;True;1;text extracted and checked and selected;2019-01-06
https://www.ilmiodrone.it;https://www.ilmiodrone.it;Guida ai Migliori Droni - IlMioDrone.it;;;01102016;12447321006;Ultimi modelli, sconti e consigli utili: tutto quello che serve per scegliere il drone più adatto alla tua preparazione e alla tua attività!;sales, training, filming/imaging, components;True;True;;Genova;False;True;True;1;text extracted and checked and selected;2015-03-21
https://www.aviony.net;https://www.aviony.net;Noleggio Droni Liguria | Riprese Aeree Liguria e Nord Italia;. Enac : 9215 Aviony offre un servizio di riprese aeree professionali con droni in tutto il Nord Italia;;+393285431923;;realizzare riprese con droni e’ una pratica sempre piu’ utilizzata per raccontare la vostra azienda tramite foto aeree e video riprese professionali;renting, filming/imaging;True;True;;;True;True;True;1;text extracted and checked and selected;2016-03-31
https://www.helivr.com;https://www.helivr.com;HeliVR riprese aeree professionali, azienda riprese con drone;. zza Risorgimento 24 52100 Arezzo   Italy, Piazza Risorgimento 24 52100   Arezzo;info@helivr.com;+393292787487;IT02273000519;HeliVR azienda di riprese aeree con drone che realizza video professionali per cinema, spot pubblicitari e moda. Azienda Autorizzata ENAC per voli in città;filming/imaging;True;True;https://twitter.com/heli_vr, https://www.instagram.com/heli.vr, https://www.facebook.com/helivr.it, https://vimeo.com/helivr;Arezzo;True;True;True;1;text extracted and checked and selected;2011-09-14
https://www.hardis.it;https://www.hardis.it;Hardis Italia - Rendi la gestione logistica il tuo vantaggio competitivo.;Via Machiavelli 1 – 20025   Legnano ( MI ) Via Email : info @ hardis . it Sui social : Hardis Italia, Galleria San Babila   4 / C - 20122 Milano Italia;info@hardis.it;2016679, 1468216, 11461040153;11461040153, IT11461040153;Hardis Italia eleva la gestione logistica di magazzino, fabbriche e negozi integrando il software di gestione magazzino Reflex WMS.;inspection, design;True;True;https://www.linkedin.com/company/hardis-italia;Milano;False;True;True;1;text extracted and checked and selected;2002-10-29
http://www.hobbymedia.it;http://www.hobbymedia.it;HobbyMedia - News di Modellismo, Droni e LEGO;. Hobby Media Srl via Sesto Miglio 74 00189 ROMA ( Italia;redazione@hobbymedia.it, staff@hobbymedia.it;07941371002;07941371002;Il sito di news modellistiche a cura della redazione di Xtreme RC Cars: la rivista di modellismo radiocomandato e droni numero uno in Italia.;;True;True;;Roma;False;True;True;1;text extracted and checked and selected;2004-05-12
http://www.dronesbench.it;http://www.dronesbench.it;DRONESBENCH – Sistemi di Misura e Tecniche di Sviluppo per Droni Professionali;Via Sant’Alfonso dei Liguori   61 – 71121 Foggia;info@dronesbench.com;+390881771548, 02422080719;02422080719;vendita la dpm elettronica propone i suoi banchi dronesbench standard per testare droni commerciali fino a 15 kg payload e progetta dispositivi su misura;sales, components;True;True;https://www.facebook.com/dronesbench, https://twitter.com/dronesbench, https://www.youtube.com/channel/UCxsVzP0fsJUDH-L5D8MW1hQ, https://www.instagram.com/dronesbench, https://www.linkedin.com/company/dronesbench;Foggia;True;True;True;1;text extracted and checked and selected;2017-10-31
https://www.dronemotions.com;https://www.dronemotions.com;Drone Emotions | Vendita Droni Professionali per Riprese Video Aeree;Via Pedonale Isarco 5 20847 Albiate ( Monza;info@dronemotions.net, postacert@pec.dron, risorse.umane@dronemotions.net;08844430960, 3474333302;08844430960;Progettazione e vendita droni professionali per perlustrazione, sorveglianza, salvataggio, fotogrammetria, riprese aeree, fotografie aeree. Droni multirotore.;sales, filming/imaging;True;True;https://www.instagram.com/drone_emotions, https://www.linkedin.com/company/drone-emotions-srl, http://www.pinterest.com/dronemotions, http://www.youtube.com/dronemotionsweb, http://www.facebook.com/dronemotions;Milano;False;True;True;1;text extracted and checked and selected;2013-10-11
http://www.errealcubo.com;http://www.errealcubo.com;Errealcubo - Studio di Ingegneria e Architettura - Droni fotogrammetria;Via Ghirardacci 1   40137 Bologna   Italy;info@errealcubo.com;+393497393072, 03256491204, +393337989331, +393387305596, +393386494061, +393333412788, 3256491204;03256491204;Errealcubo offre fotogrammetria da drone, acquisizione 3D, elaborazione, restituzione, analisi, gestione di dati metrici, video editing, 3d mapping;filming/imaging, inspection;True;True;https://www.youtube.com/channel/UC8rH48slKtBXICf_a5RTDcg, https://www.linkedin.com/company/errealcubo---studio-di-ingegneria-ed-architettura, https://www.facebook.com/errealcuboitaly, https://plus.google.com/101553492062345285139, https://it.linkedin.com/in/michelerusso77, https://www.linkedin.com/in/marcello-bolognesi-0803ab6b, https://www.linkedin.com/in/elena-zambello-47114044/it, https://it.linkedin.com/in/valentina-russo-96895a41, https://plus.google.com/+MicheleRusso77/about/p/pub, https://www.facebook.com/valerux;Pistoia;True;True;True;1;text extracted and checked and selected;2016-02-11
https://www.drone24hours.com;https://www.drone24hours.com;Drone24Hours.com | Droni FPV per ogni tua esigenza;Via Motta Santa Anastasia 47 Roma 00133 Italia;info@drone24hours.com;3520299;15429411000;Drone24Hours, Rivenditore ufficiale dei migliori brand FPV del momento.Acquisto Online Sicuro. Consegna in 1 Giorno, Pagamenti anche alla c..;distributing;True;True;https://www.facebook.com/drone24hours, https://www.instagram.com/drone24hours;Roma;False;True;True;1;text extracted and checked and selected;2016-12-30
https://fpvdroneracing.it;https://fpvdroneracing.it;FPV drone racing;Via della Repubblica   23 Casalguidi Serravalle P . se 51034 Pistoia, Via N . Rodolico   90 S . Agostino 51100 Pistoia;info@fpvdroneracing.it;01404430470;01404430470;velocidrone tryout - race 2 - coppa italia drfdal 12/02/2022 al 12/02/2022 seconda e ultima tappa dei velocidrone tryouts 2022iscriviti ai velocidrone tryouts;entertainment/race;True;False;;Pistoia;False;True;True;1;text extracted and checked and selected;2017-10-30
https://assistenza-droni.com;https://assistenza-droni.com;Assistenza Droni: centri assistenza per Droni;;;01543360992;01543360992;Assistenza Droni: vendita Droni, centri assistenza Droni, offerte e prezzi Droni, assistenza quadricotteri, assistenza elicotteri radiocomandati, problemi Droni, guasti e ricambi Droni;sales;True;True;;Rimini, Cuneo;False;True;True;1;text extracted and checked and selected;2017-11-25
https://www.abzero.it;https://www.abzero.it;hm - ABzero;. IVA 02249730504 Sede legale : Pisa;;02249730504;02249730504;risultati attesi e raggiunti: grazie alla realizzazione del progetto, è stato possibile ri-progettare e ingegnerizzare ex novo il prototipo della smart capsule migliorandone l’usabilità e l’implementazione del prodotto per poi procederne alla certificazione;;True;True;http://twitter.com/AbzeroSrls, http://www.facebook.com/abzerosrls;Pisa;False;True;True;1;text extracted and checked and selected;2017-01-10
https://www.georobotics.it;https://www.georobotics.it;Georobotics - Soluzioni tecnologiche per ambiente e territorio;Viale Vincenzo Verrastro   42 - 85021 Avigliano ( PZ ) & nbsp & nbsp & nbsp & nbsp & nbsp & nbsp Italy, Viale Vincenzo Verrastro n°42 – 85021 – Avigliano ( PZ ) Italy, Viale Vincenzo Verrastro 42 - 85021 Avigliano ( PZ ) Italy;info@georobotics.it, supporto@georobotics.it, amministrazione@georobotics.it, servizionline@pec.enac;312016, +393284123446, 01896450762;01896450762;Droni, Potenza Basilicata, Fotogrammetria, Emergenze, Agricoltura di precisione, Ispezioni infrastrutture,Servizi audio video dall'alto, Georobotics;filming/imaging;True;True;https://www.facebook.com/pinobrienza, https://www.facebook.com/georobotics.it, https://twitter.com/georobotic, http://pinterest.com/georobotics, http://instagram.com/georobotics;Potenza;True;True;True;1;text extracted and checked and selected;2014-07-25
http://www.droneproject.eu;http://www.droneproject.eu;Drone Project – Operatore APR autorizzato ENAC;Via Antonio Meucci 7 – 48124 Ravenna;info@droneproject.eu;+393358375923, +393482256725, +393925757394, 30092016;;newsdroneproject news;entertainment/race, filming/imaging;True;False;https://www.facebook.com/droneprojectsrl, https://www.instagram.com/checconaglia, https://www.youtube.com/channel/UCfrAxdmq8dEFVbKTKnxq79A, https://twitter.com/home;Ravenna;False;True;True;1;text extracted and checked and selected;0
https://archetipo-srl.com;https://archetipo-srl.com;Archetipo srl - Telerilevamento con droni e metodi per ricerca archeologica.;: 2008 e 19011 ) e di Master in Web Marketing Archeologa e disegnatrice laureata a Padova in Lettere, Via S . Salvatore   33 / 1 35127 PADOVA – ITALIA, Via S . Salvatore 33 / 1 35127 PADOVA – ITALIA;info@archetipo-srl.com, amministrazione@archetipo-srl.com;+390495477958, 33135127, 04907130282;04907130282;Archetipo srl è una società ad elevato contenuto tecnologico che utilizza e sviluppa servizi di telerilevamento mediante droni e metodi per la ricerca archeologica. Professionisti in possesso di laurea specialistica, diploma di specializzazione, master e dottorato di ricerca nel campo dei Beni culturali e ambientali...;;True;True;https://it-it.facebook.com/Archetipo005, https://it.linkedin.com/company/archetipo-srl-drone-services, https://www.youtube.com/channel/UCOJURk3rv_K3yggGZSB4yog;La Spezia, Padova;False;True;True;1;text extracted and checked and selected;2015-03-26
https://airdroneservice.it;https://airdroneservice.it;Noleggio Droni Roma: Air Drone Service Roma;Via Cornelia   498 – 00166 Roma, Via Cornelia   498 00166 Roma;info@airdroneservice.it, airdrone@legalmail.it;0689573980, 3517114675;15527481004;Aerofotogrammetria, produzioni cinematografiche, termografia, ispezioni di strutture, agricoltura, videosorveglianza, search & rescue, Ambiente, Rilievo 3D;manufacturing, renting, filming/imaging, inspection;True;True;https://www.instagram.com/air_drone_service, https://www.facebook.com/www.airdroneservice, https://www.youtube.com/channel/UCgTeatR7DE3vsxgv-pYVNjQ;Roma;False;True;True;1;text extracted and checked and selected;2017-05-31
https://www.airmap.it/en;https://www.airmap.it/en/;AIRMAP - Remotely Piloted Aircraft System;2018 Tags : Airmap   SAPR More Posts in Who we are Share this Post Tweet Contacts AIRMAP ® Trieste, : ® N . 0001584570 Contacts AIRMAP ® Trieste Italy, : ® N . 014048797 Numero di Registrazione Italia, : ® N . 014048797 Italy;info@airmap.it;+393930554962, 0001584570, 014048797, 01233670320;IT01233670320, 01233670320;Remotely Piloted Aircraft System;design;True;True;https://www.facebook.com/airmap.it, https://facebook.com/airmap.it;Trieste;False;True;True;1;text extracted and checked and selected;2013-03-20
https://my-fpv.com;https://my-fpv.com;Pilota Droni FPV | Noleggio Droni con Operatore, Droni FPV e Inspire 2.;;luca.morandini.video@gmail.com;04262370986, +393383748524;04262370986;Pilota di Droni FPV Certificato | Servizio di Noleggio Droni con Operatore, DJI Inspire 2, Droni FPV e Cinelifter FPV;renting;True;True;https://www.facebook.com/myfpvideo, https://www.linkedin.com/company/my-fpv, https://www.instagram.com/l.morandini, https://twitter.com/my_fpv, https://www.youtube.com/channel/UCP-Zv_VyPHXZUTSXAzpMPGg;Roma, Salerno;False;True;True;1;text extracted and checked and selected;2020-08-01
https://www.humanfactoritalia.com;https://www.humanfactoritalia.com;Human Factor Italia;Via Cattedrale 9 – 14100 Asti;info@humanfactoritalia.com;01621160058;01621160058;Vi aiutiamo ad affrontare il futuro dotando la vostra Azienda e i vostri Manager degli strumenti che permettono, alle Organizzazioni Altamante Affidabilidi, far fronte all’imprevisto e al cambiamento.;training;True;True;https://www.linkedin.com/company/human-factor-italia, https://www.facebook.com/humanfactoritalia, https://www.instagram.com/humanfactoritalia;Asti;True;True;True;1;text extracted and checked and selected;2017-03-13
